response_id,should_sign,free_response
238,0,"Signing this compact would remove the safety's given to students of color, trans students, and financially underprivileged students. Moreover, this continues to place higher values on STEM fields (or whatever ""hard sciences"" means) rather than our just as important humanities departments. The Vanderbilt Peabody College of Education and Human Development is THE top education school in the country, and yet receives little attention from the university, or this compact for that matter. Why not give them tuition waivers? Overall, this poses to harm Vanderbilt's diverse community and keep its overly unattainable elitist status, and leaves the rest of us to rot."
239,0,The compact undermines student identities and is not in line with out university’s value or Diermeir’s principled neutrality-signing it as it is would be a clearly politically charged action.
240,0,"Some of the points on the compact are beneficial, preferential, even; however, Vanderbilt should not willingly submit to the Trump administration and sacrifice its institutional and educational freedom for funding money, especially as part of it will require Vanderbilt to assume positions on student identity and freedom of thought that are antithetical to Vanderbilt’s mission. Vanderbilt should chose to dare to grow, but not through signing a Faustian bargain."
241,1,Tuition freeze
242,0,Essentially a bribe.
243,0,"I don’t think that some agreement with the government for the basis of funding is a good idea. Rather, congress should approve funding for schools, and if they do not like how some aspects of universities are run, laws should be enacted (as was shown by the Supreme Court ruling against affirmative action). There is no reason to negotiate directly with executive branch to decide these things. I don’t think they should sign any agreement, either the government passes a law or it doesn’t."
244,1,I like more funding
245,0,"This is a massive overstep of this Administration, which I would say is moving toward Fascism. This is their attempt to silence those who disagree with them, which is unconstitutional and unacceptable. We should not sign this compact if we value freedom of speech, press, expression or any other constitutional freedoms."
246,0,This compact is a fascist attempt from the Trump Administration to censor free speech on campus and further harm our international/queer/POC and other marginalized communities on campus. The federal government has no business in restricting free speech on campus and aligning ourselves with the compact would be allowing for a gross overstepping of the government. I would be disgusted to call myself a member of Vanderbilt University if we bow down to this harmful rhetoric.
247,0,"It’s contradictory. Protect free speech, but also reform units that disagree with conservative views? Removal of DEI?"
248,0,"Vanderbilt’s strength rests on inclusive excellence and the vigorous exchange of ideas. Imposing a strict cap on international student enrollment—especially at such a low percentage—risks constraining the very intellectual diversity and civil discourse that animate our campus. To sustain a community enriched by a broad range of perspectives and knowledge systems, Vanderbilt should remove such caps and maintain a holistic, country-agnostic admissions approach that welcomes talented students from all nations. Removing race- and gender-conscious approaches from admissions and hiring risks narrowing the university’s capacity to identify promising talent that has been historically unseen, under-resourced, or structurally excluded. A great research university thrives when it gathers people whose perspectives have been shaped by different histories, neighborhoods, and educational pathways; absent intentional attention to equity, many of those voices never make it to the table. Vanderbilt should keep these policies of admissions and employment to keep these chances. Taking punitive action against departments for holding views perceived as inconsistent with conservative ideals and enforcing protest restrictions that curtail students’ ability to express dissent risks undermining core principles of free expression and academic freedom. Such measures edge toward illiberal control rather than open inquiry, narrowing the range of debate precisely where universities should cultivate good-faith disagreement. Vanderbilt, as well as its staff and students, should be given free will to take a side on certain issues. Accordingly, I urge Vanderbilt to advocate forcefully for revisions that advance the interests of students and faculty—or, failing that, to withhold its signature."
249,0,"I do not believe in limiting international student admissions or providing hard sciences tuition breaks, and the wording around departments belittling conservative ideas is vague and could be misinterpreted."
250,0,"I don't agree with limiting free speech and defining sex. In addition, I think there should be more clarfication regarding ""Universities must reform or remove units that “'punish, belittle, or incite violence against conservative ideas.'"""
251,0,"The compact's clear intention is to reduce the number of international students as well as the diversity of our student body with respect to race, ethnicity, gender, and other markers of identity. This opposes Vanderbilt's mission to encourage diverse ideas that come from different perspectives and lived experiences. It seems straightforward to me that the compact does not align with this value, which is important not only for the cultivation of a liberal arts environment but also for creative and innovative advancement in Vanderbilt's research and development interests. Additionally, the compact's aim to protect conservative free speech is simply a less effective way of trying to accomplish what Vanderbilt is already surprisingly good at. I have been impressed by the existence of a true culture of free speech at this university which is lacking in much of American higher education. Space is made for, and respect given to, conservative opinions expressed at this institution, and I don't think we need ""help"" in that regard from the Trump administration."
252,0,"Vanderbilt already has a strong commitment to institutional neutrality, and has strong ties with donors and adequate funding to defend themselves and sustain growth. Identities should not be surprised, and ideologies should not be particularly supported. The compact explicitly expressed the obligation to uplift far right voices and surpress valid identities."
253,0,Trump has proven time and time again he does not care about education or any forms of educational development. Signing this is a death warrant to Vanderbilt. If we want to protect education not only in Vanderbilt but this country; WE MUST NOT SIGN IT.
254,1,Vanderbilt benefits from the federal government thus it is beholden to its standards
255,0,"I believe some aspects of the compact will be benefical, such as  freezing tuition rates. However, many other aspects I am worried about, such as what taking action against departments deemed unwelcome to conservative thought might look like. I also request many, many more details as the implementation of such measures greatly impacts whether Vanderbilt should sign the Compact."
256,0,"This is yet another attempt by the Trump administration to push a specific ideology upon colleges and universities. This time around its just worded a little nicer compared to what Columbia and Harvard got. As it stands, republican, conservative, and right leaning views aren’t noticeably suppressed or belittled, let alone punished. The end goal of this whole thing is the suppression and eventual elimination of all views that aren’t aligned with the far-right views of the current administration. Even if Vanderbilt signs this, it is inevitable that they will come back with another, stricter compact. This certainly does’t make Vanderbilt immune from lawsuits or other such actions from this administration. The other important thing to remember is that this administration will eventually no longer be in power. At that point any benefit gained by playing along will be outweighed by the damage to Vanderbilt’s reputation as a politically independent institution that upholds freedom of speech and expression for students and staff alike. In short, don’t give into these demands as they will only hurt Vanderbilt."
257,0,"Equality in Admissions already exists, affirmative action was struck down by the Supreme Court. Generally, It is impossible to stay neutral as an institution while also ""appeasing to conservative ideas and ideals"" both for gender-as-sex ideology and ""departments that punish, belittle, or incite violence against conservatives."" The most important word in that phrase is ""belittle-->"" whatever counts as belittling can not be determined by a court or jury, and puts minorities with non-conservative views at risk. If someone's feelings are hurt after an open debate and they report it as ""conservative belittling,"" would the student who shared their opposing views be punished? Generally, this document is too broad and nondescript to be signed, and allows people who disagree with the Trump administration to be at risk on campus."
258,1,I think we should negotiate some aspects in order to get some federal funding back.
259,0,One of the points on the contract is to get rid of free speech (being unable to criticize conservatives) and its weird in general
260,0,"While many sections of the Compact may appear principled, such as “Equality in Admissions” and “Student Equality”, they are, in reality, destructive and disadvantageous to Vanderbilt students. Prohibiting consideration of race, ethnicity, and other identity factors in admissions blatantly ignores the historical and structural inequities that persist today. Additionally, defining gender solely in terms of “reproductive function and biological processes” erases and invalidates the identities of students who do not align with their assigned gender or with binary gender categories. Additionally, the Compact’s insistence on impartial protection of conservative views risks privileges certain ideologies and suppressing open dialogue. Therefore, President Trump’s Contract threatens the values of inclusion, intellectual freedom, and equity that Vanderbilt strives to uphold."
261,0,"We should not give in to the demands of dictatorship! As a stand-out university, we should be LEADERS and respectfully decline this pact, leaning on our alumni, students, and staff and setting a trend for just, righteous, and critically aware university affiliates to follow."
262,0,"Trump is a disgusting president who is trying to force his dated-beliefs onto Vanderbilt. There should be a separation of the government from this private institution and he is using funding as his leverage. As Vanderbilt has copious funds and alumni contributions, we should dip into those funds instead of relying on the government. I would be truly beyond disappointed if Vanderbilt signed this Compact."
263,0,"Signing this compact means complying with a President who is a convicted felon and an administration that actively infringes not only on the Constitution, but the rights of citizens, especially racial and sexual minorities. Although it may bring short-term benefits, the lasting impact on the culture of free speech and advocacy that Vanderbilt is proud to have right now will be devastating. The legacy of Vanderbilt as an institution, as well as those who are in power, will be forever marred by the fact that they did not choose to stand for their students or for their values that they proclaim. Do not sign the compact."
264,1,"I see no reason as to why these things are bad. Race and gender should have been long removed from admissions and employment. Even if the university ""says"" they comply, I'm glad they will actually be held accountable. It's about time that tuition be taken care of and conservative ideas be respected. Vanderbilt would do themselves a big favor by signing the Compact."
265,0,Sparking violence because of political opinions is crazy in a country built on free speech. Seems like a roundabout way to push for whiter institutions
266,1,"Vanderbilt is already in compliance with the majority of the Compact, and the remaining provisions are frankly quite reasonable. Additionally, from a pragmatic non-ideological and non-idealistic perspective, the University should be pursuing a path that guarantees its survival, not one that will lead to financial ruin and further closing of academic programs as witnessed at other institutions."
267,0,"It is my opinion that the Trump administration presented this compact to Vanderbilt because at key junctures over the last few years, such as the protests at Kirkland in 2023 and the removal of diversity, equity, and inclusion resources, when presented with a choice between standing for free speech and an open community or acquiescing to the right, Chancellor Diermeier has at every turn chosen to make a mockery of ""principled neutrality"" and emasculate this university. Diermeier should take this opportunity to do the right thing and regain some respect among the student body and reject this Faustian deal."
268,0,I think restrictions on international student population and genders will foster a community of exclusions and oppression.
269,0,"I think while there are certain aspects of the compact that could be beneficial to current students and future applicants, the compact proposes a direct threat to one of our main values as an institution. Chancellor Diermeier has on many occasions stated his commitment to institutional neutrality and I believe that while signing the compact would ensure our funding (for the time being) it would also directly contradict one of our institutions highly important values. Signing the compact will ultimately not end up securing funding for the university long-term. It will however, put students and faculty in a position where they feel less inclined to exercise their right to free speech and make this institution not an independent one, but one legally bound to the government. How can we educate students to respect differing views and neutrality if the institution itself does not practice the neutrality it so highly speaks of?"
270,0,"This compact is so obviously a direct threat to the freedoms students and higher education institutions. Vanderbilt will be a less safe. Less people will be allowed to come here, let alone WANT to be here. Less opportunities will exist. Less people will be given the chance to dare to grow (a slogan I think is already naive in its belief that students here currently get such opportunities). This compact is about control and surveillance. Vanderbilt is a private institution. The school’s decision will break its commitment to “principled neutrality” either way, an unrealistic commitment in the first place. Should Vanderbilt agree to this compact, it will become a lesser institution."
271,0,"We should not change campus culture and impact marginalized groups just for money. Additionally, conservatives are not the silent majority and already control many of our systems, but it’s also just a violation of the first amendment they preach about to silence people for not liking ideas. These ideas themselves are also just harmful to multiple groups of people and is not going to be a long-term benefit."
272,1,It is way better
273,1,"Vanderbilt already meets most of the requirements in this compact (international student population is under 15% and we do not have over $2 million per student endowment, for example) and signing it would not cause significant change. Additionally, Vanderbilt already complies with many federal policies to receive federal funding - this is well precedented."
274,0,The section allowing punishment for anti conservatism crosses the line of freedom of speech too much. Allowing the government (which is extremely conservative) have the ability to deem ideas as anti conservative and have the power to punish such ideas is a facist ideal. Moreover capping international students would limit funding for student aid and take away a lot of money from the university. Overall the compact is scary and should be turned away if Vanderbilt truly believes in institutional neutrality.
275,0,It blatantly disregards Vanderbilts motto of “Institutional Neutrality”
276,0,"This is insane!! From what I gathered, if Vanderbilt signs the Compact, our individuality is essentially being striped away."
277,0,"This goes against everything that we claim to stand for: neutrality, a campus that fosters growth, a diverse and welcoming place to learn. If Vanderbilt cares at all about the students over its funding, which we were doing great before this pact to begin with, then they will not agree to this."
278,0,"I don’t like that the government is weighing into the administration of a private university. While I agree with some of the statements in the document, I don’t appreciate the larger issue it represents. Additionally, many of the requirements of this compact are extremely vague, and I worry how the interpretation from the federal government will differ from what is initially expected."
279,0,Do not be intimidated and subjected to a higher power.
280,0,"Compact reduces gender to sex, ignoring legitimate scholarship in gender studies and other social sciences in favor of Trump's ideological agenda. This is a violation of free speech; people should be free to express their views and research on these subjects in academia. I also take issue with this hard science favoritism, as if the humanities are less important, though that's not a major issue. Also, the terminology used in the compact is quite vague and can easily be taken advantage of."
281,0,"The compact is biased against students of color, LGBTQ+ students, and students studying the arts and humanities. ""Protecting free speech"" and ""preserving conservative ideals"" could mean the destruction of any speech that supports students in the groups mentioned above. I also believe that signing this compact would violate Vanderbilt's neutrality policy."
282,0,"Disagree with last line about limiting critiques of conservative viewpoints, most others I agree with (maybe not the assigning gender terms one either)."
283,0,"The clause about anti-conservative rights is too vague, and this administration would use it to hurt vulnerable students."
284,0,I fear that signing the Compact would harm many of the diversity and inclusivity we have on campus and drastically impact student resources.
285,0,Violates inclusivity factor
286,0,"I am incredibly disappointed that Vanderbilt is even considering signing this compact. By signing, Vanderbilt would essentially surrender our freedom of speech and kowtow to a racist and corrupt administration."
287,0,"We are a private institution and it is our right to decide how to govern some of our policies. If we let the government dictate these agreements now, they can hold over our funding for the long term. Look at Columbia for example."
288,0,"I think that most problems the compact tries to address are legitimate; however, I'm worried by the current phrasing of the compact around political protections. Instead of turning this down completely, can we please talk to the White House about reaching a more neutral agreement while still securing the funds that Vanderbilt really needs as well as combating things like tuition increases, grade inflation, and concerns about free speech from all sides? It's not like Vanderbilt hasn't accepted federal funding before..."
289,0,"I think that international diversity is such a large part of what makes Vanderbilt, Vanderbilt!"
290,0,"Taking action against departments that ""belittle conservative ideas"" goes against Vanderbilt's core values of institutional neutrality. I would be ashamed to still attend this university if Vanderbilt decides to abandon its values and accept this bribe from the Trump administration."
291,0,It would sell out the student body and faculty who actually champion diversity of identity and perspectives. Why should the president decide what I’m allowed to learn he doesn’t pay my tuition.
292,0,"This document is a violation of free speech; promotes limited binary perspective on gender, and attempts to push a conservative agenda that punishes any member who disagrees with Trump’s authoritarian regime."
293,0,"This compact has language that would further perpetuate harm against our international students/alum has been facing, along with targeting several other groups. It is a fascist attempt at censoring free speech on campus and would force Vanderbilt to align with the Trump Administration."
294,0,"""Departments that target conservative views: Universities must reform or remove units that “punish, belittle, or incite violence against conservative ideas,” while still enforcing rules against harassment and incitement."" This is completely against freedom of speech. This would honestly be a horrible choice for the institution"
295,0,"Very one-sided and limits institututional freedoms, and by extension, students' individual liberties"
296,0,The government should not dictate university policies. Student freedoms should be protected.
297,1,"Accessibility is the core principle of Vanderbilts experience. Cost is the number one driver of college decisions. The tuition freeze outlined in the plan allows more students to be able to commit to a Vanderbilt education, at a reasonable price. The tuition increases in the past have been extreme, and will only continue."
298,0,"I personally believe that we must reject this compact in any form, and that no amount of negotiations will yield a product that doesn’t violate our core principles."
299,0,It’s not representative of our schools values as a whole and doesn’t all for free speech and ideas.
300,0,"Capping International student's enrollment just because Trump is racist seems quite ridiculous for our institution to do. At least a third of our student body is international, Vanderbilt would fall in ranking without international students. I doubt Diermier really wants that. Additionally, we all know that if we accept this we will be controlled by Trump and his politicals. By accepting this, we are taking a stance. We claim to not be, but by doing this we through diversity out the window and go full in on conservative ideals. Through being independent and safe at Vanderbilt out the window, welcome to Republican world."
301,0,"So many professors would quit due to the restraints on what they would be able to teach, which would not be good for our university’s reputation. We shouldn’t be selling outs."
302,0,Limiting international students seems xenophobic; whole compact is biased towards conservative ideals; restrictions on gender; unnecessary government intervention in university affairs
303,0,"The compact caps international student enrollment, and orders the university to follow strict definitions that curtail civil rights. It is a blatant overreach of federal power and makes the Trump administration judge, jury, and executioner for what is deemed acceptable at Vanderbilt."
304,0,Counter
305,0,Should not be conforming because of the pressure of any president
306,1,TRUMPPPP
307,1,All 10 points are great and will help Vanderbilt be the college all other universities should strive to be.
308,0,"This compact is disguising pushing ideals of the Trump administration with language about students rights and neutrality. I fear that this act would allow the administration to shut down valuable classes and departments that provide genuine help to students on our campus, making them feel more included, such as the department of Gender and Sexuality Studies. Additionally, it should be noted that in Biology classes, we are taught the process of human development and fetal development and it is never stated that there are biologically more than one two genders. I'm not sure why they are making it seem like this is not the case. I fear that signing this compact would put us as an institution at the mercy of the Trump administration, and it will create harmful barriers and rhetoric towards certain minority groups here on campus, such as the LGBTQ+ community and international students."
309,0,trump sucks and is actually bonkers; vanderbilt has a deep history with inclusion and international students and would be insane to sign this
310,0,"The section of “purposefully punish, belittle, and even spark violence against conservative ideas.” violates Vanderbilt's policy of institutional neutrality."
311,0,This would devalue my education.
312,0,"Signing the contract in my opinion is just a sign of complicity. The demands/requirements from the trump administration won’t stop changing and becoming more oppressive, and by signing it, we’re acquiescing to the Trump administrations demands now and in the future."
313,0,"Academic freedom should not be compromised with compliance to a specific set of political ideals. The financial benefits of this compact coming at the expense of reinforcement of conservative beliefs is a clear breach of Vanderbilt’s pride of social integrity, to which signing this compact would give unorthodox preference to the Trump Administration’s policies. In accordance to Vanderbilt’s Community Creed, we must not give into this perversion of our commitment to equity and personal freedom."
314,1,"I 100% agree with the idea that by including race or gender quotas in the admission process, we contradict the fact that merit and character should be the primary considerations in getting into Vanderbilt. I would also like to know what the Trump administration will define as ""hard sciences""."
315,0,Say no to trumps fascist ideology!
