response_id,should_sign,free_response
161,0,"The compact has three insanely glaring problems around how it is written and what it is asking: (1) They are asking to screen every student and current students and use a ambigous, very vague ""anti-american bias"" as a key factor on deciding a student's academic capability --- frankly speaking, this is absurd, with such a vague definition most definitely being twisted to ""anyone who oposses Trump"" --- this is a massive overstep for putting down peaceful protest and dissent, (2) the part with “transform or abolish institutional units that purposefully punish, belittle, and even spark violence against conservative ideas"" is in absolute violation of the freedom of speech and the principle of neutrality and neutral political discourse Vanderbilt was founded on and continues to stand for --- my roomate is of an oppisite political opinion, while I trust him completely now after much time together --- I would not have been willing to being friends in the first place if it meant he could expulse me at any moment he wanted because of the more 'liberal-anti-conservative' things I say. (3) Finally, the sharing of sensitive student data is a violation of privacy and seems like it will only lead to increased government and federal survelience power. I see many of my friends voting yes simply because of the threats made by Trump and his administration --- with so much arbitrarily defined or not defined at all it is safe to say this is not a good idea."
162,0,It's not in Vanderbilts best interest to diverge from its previous statements on institutional neutrality which Deirmier so adamantly defended in the Bloomberg article. Signing a pact that punishes against outwards disgreement or bashing of conservative ideals is a violation of free speech and a controlling narrative thats concerning to consider being prevalent on a college campus built upon students and their voices. Some of the other ruling wouldn't have a vast effect on day to life except for the imposing restriction of free speech. that is ridiculous.
163,0,"I don't think that its the governments place to be involved in how the University decides to educate its students. I also don't believe in standardized testing. Furthermore I feel like our college campus is actucally a safe space to express ideas; there is bound to be disagreement and discourse amongst students and teachers shareing there politcile opinions but thats okay. I think the school does (and if not then it defintiely should) already have rules in place to protect people who want to share their political opinions be it conservative or liberal. So i don't think government involvement is necessary to reinforce that last clause. I sincerely hope that if the school denies this then government funding doesn't get cut, and the advantage of having priority in government funding certainly shouldn't be overlooked-- it comes down to principle, and I think this level of government involvement in the long term would not be what the school wants."
164,0,It shouldn’t matter what the benefits are - Vanderbilt could be handed $1 trillion on a silver platter and you have to say no. Accepting this contract sets a dangerous precedent of the President holding money over university’s heads to get what he wants. Universities are designed to be entities that act in the best interest of their students and the study of various fields. Agreeing to this would make Vanderbilt a laughing stock in the academic world.
165,1,"To be honest, I don’t see many negatives in the contract and we should prioritize keeping government funding"
166,0,It’s awful and directly contradicts everything Vanderbilt speaks for.
167,0,This compact is antagonistic to trans students. It represents government control over higher education.
168,0,To sign this contract would be to retract every statement claiming to side with “neutrality” as an institution.
169,0,"It goes against institutional neutrality, free speech, and creating a safe space on campus for all."
170,0,"As an institute of higher education there should be no limits to one’s thoughts and ability to learn what they desire to learn. This compact would only limit creativity, diverse thought, and innovation"
171,0,"This so called “Compact for Academic Excellence in Higher Education” is absurd because it represents an alarming federal overreach into university governance, academic freedom, and personal rights. While framed as a path to “excellence,” the guidelines outlined would, in reality, dismantle many of the principles that make universities like Vanderbilt vibrant, inclusive, and intellectually rigorous. Mandating a tuition freeze without addressing inflation or operational costs would cripple resources for student support, faculty pay, and research. Forcing universities to define sex using narrow biological terms ignores modern science and the lived experiences of transgender and nonbinary students, creating an actively hostile environment. Limiting international enrollment to 15% undermines Vanderbilt’s global reputation and deprives students of essential cross-cultural learning. Moreover, banning consideration of race and gender in admissions or hiring would erase diversity efforts and perpetuate systemic inequities. Even more troubling, giving the Department of Justice oversight of campus “compliance” threatens free thought by policing ideas and departments that challenge conservative ideology. Education thrives on dialogue and dissent not government-enforced ideological conformity. This Compact is not about academic excellence, it is about political control, and its adoption would mark a chilling step away from the values of diversity, autonomy, and open inquiry that define higher education."
172,0,Government should not be able to change the curriculum of a private institution.
173,0,"Infringement of free speech and biased towards conservative ides, but I do like the idea of freezing tuition so the price of college doesn’t go up"
174,0,Don’t be a fascist
175,1,"I think the conditions are valid and will have a beneficial impact on Vanderbilt, although I would be cautious of what may come after this (in terms of future conditions that come with stipulations). If we agree to these conditions, it will be necessary to consider the implication that we will acquiesce to what he asks."
176,1,"Let's stop teaching falsified ideologies, start giving priority to American students, require merit based admission, and make college something worth going to again. There are only 2 genders and that is scientifically fact. American Citizens deserve to have more than international students. American Students after all are more likely to stay within our national economy after graduating. Race and sex should have nothing to do with college admission and shouldn't even be a question that plays a role in admissions. We can do all of this, the right thing, and make some money in doing so too. So why not?"
177,0,The government shouldn't have influence on the sexuality and gender of students.
178,0,The pact contradicts the core values that Vanderbilt prides itself on
179,0,"Regardless of my belief in any of the Compact guidelines, Vanderbilt is a private university and should not be in special agreements with the US government"
180,0,Overreach of executive authority on education
181,0,The fact that there’s two clauses about free speech is worrying. Having one about free speech generally and then one only focusing on conservatism presents a problematic dilemma that gives the government incentive to politicize schools in favor of their political policies.
182,0,Why would we want the DOJ to be able to watch more of our actions. This creates burden and prevents us from dating to grow
183,0,Its is private university.
184,0,I don't think we should sign the compact at all. It has unreasonable requests and restrictions that should not placed upon any school.
185,0,"The compact fails to highlight many discrepancies in educational standing. Bring back test scores though usually a good metric to determine student ability to succeed in college, puts a greater emphasis on that rather than what may have hindered them from obtaining a high enough score. In my opinion going test blind what the best thing a university could have done by looking at the students achievements and willpower to preserve in other aspects of their life. I am not going to go into other aspects of the compact as I believe it is already aware how terrible it is(cutting funding) but those are my main points"
186,0,Please no
187,0,It is insane to me that the federal government wants to control politics and ideas on campus. They will turn anything slightly against conservatives into their definition of violate or belittling to remove it from campus. College are a place of debate and knowledge for both sides.
188,0,"The university should maintain its independence as an institution separate from the federal government. Especially when this compact places restrictions on enrollment of international students and definitions of gender, which are reflective of the administration rather than the law, we need to maintain our ability to make these decisions as an institution."
189,0,"it’s harmful to not only students but the integrity of Vanderbilt as an institution. Vanderbilt’s motto is Dare to grow, this administration and contract contradicts what Vanderbilt stands for. This contract will not challenge us it will undermine Vanderbilt’s community restricting our ability to dare to grow."
190,0,This will devalue our education.
191,0,"A university should not subject itself to self-silencing criticism of an entire political side. While some of the aspects are appealing, the requirement that the school is not allowed to criticise conservative ideology is a mockery of free speech and will be used as a leverage to censor criticism towards the government, making the deal untenable. You should never sell out your political rights to whoever happens to be the highest bidder at that moment."
192,0,freedom of speech
193,1,It’s common sense
194,0,"This document is a clear tactic to advance a bogus political agenda by pairing it with reasonable or enticing measures. I would love to halt tuition each year and do believe there should be more transparency in admissions. But my own personal benefit is not worth the dangerous political precedent that will be set by allowing the White House to define and dictate what should be private institutional interests. In particular, the incredibly broad language in combating ""violence against conservative ideas"" is blatantly political and WILL be used to repress both science and good-faith freedom of speech as well as dangerous rhetoric."
195,0,We can’t compromise our values
196,0,"The compact is basically getting rid of the diversity that Vanderbilt so proudly praises itself on. By reducing the amount of foreign exchange students in the student visa program to a cap of 15% AND, “no more than 5% shall be from any one country,” you get less diversity and much less opportunity for the university to possibly have more astonishing students. In a way, it makes sense that the university would choose students with a higher family income, BUT that is NOT the only basis that they’re chosen from. ALSO, “to screen out students who demonstrate hostility to the United States,” is WILD. Categorizing these foreign students as possibly being hostile???? SO we’re gonna send ALL their information and their ENTIRE background to the Department of Homeland Security yeah that’s great and makes perfect sense. Have we had any national threats at Vanderbilt with admitting foreign exchange students??? BUT WAITTT, “any institution may maintain preferences in admissions for American citizens.” wow. I smell discrimination but idkkk. And saturating the campus with “anti-american values” hello? Where? If this is how the admissions process will be in the future, then all of these diverse minority groups will just continue to shrink and then how can this be a welcoming campus? How can you truly feel at home and feel like you belong in a place that has so few people similar to you? ALSOOOO drilling this idea of two genders is WILD. What would happen to the LGBTQ+ communities and students? This whole compact is targeting certain communities and “justifying” it in this flawed idea of “higher education.” Also categorizing degrees into this idea of “hard sciences,” is INCREDIBLY biased. Yes, there are difficult sciences, I’m a STEM student, BUT then that undermines the other majors that are so SIGNIFICANT and so IMPORTANT. They are all difficult in their own ways, and there is no means to categorize them as just broad as “hard” and “easy”. ALSO reducing the funding??? Vanderbilt is renowned in their research, in their LIFE SAVING research actually. This will affect every student on campus, especially the ones that this compact targets. I do not want to feel scared about my future because of things I can’t change about myself, and I know many other students feel the same. There's so many flaws and so many things wrong with this, and I hope the chancellor does NOT sign this, especially not as it currently stands."
197,0,"This would give the government way too much power over the university. I am particularly worried about what it means to ""punish"" departments against conservative ideas. That could mean anything that they want it to mean. This would have severe repercussions for everybody here. Also, wouldn't everyone just switch their major to a ""hard science""? This compact obviously wasn't written by anyone that has stepped foot on a college campus in the past 50 years. Like, Trump graduated college before my mom was born. That's wild!"
198,0,what the hell??
199,0,"If Vanderbilt is to truly be an institution conducive to hosting open, insightful dialogue and civil discourse, as is promised to us relentlessly from the moment we enroll to the moment we graduate, they will not sign this Compact as-is, or in any revised format. The foundation of strong civil discourse and exchange relies on the free exchange of contrasting ideas: this includes scholarship, research, and opinions that ""belittle"" conservative ideas. Signing this contract would be shameful for a multitude of reasons, but foremost it would be a revocation of what this university stands for above all, and that is unfettered free speech."
200,0,"I say this as a republican, who wants less government interference in my country. Tuition freezing and less money from full paying international students could lead to less income for the university itself, which scares me. Also, especially as a private university, those types of decisions should be solely up to us. We will become more reliant on the deal and holding on for dear life to government funding. That gives excess power to the DOJ and government. Does that potential not scare you a little bit? Also, DEI is a legal thing now. It’s separate from this."
201,0,Policies go against what Vanderbilt's values stand for
202,0,my major and field of study is strongly supported why one political side. as an environmental science major and sociology major my class discussion center on the fact that these field are real and impact our world. I do not want to spend my classes trying to prove that my field of study is real and relevant rather than discussing real solutions and how we can make our world better.
203,0,"I agree with Vanderbilt’s Democratic Council in the argument that a lot of components of the Compact sound very attractive (notably the tuition freeze), but added commentary on the limitation of conservative attacking throughout campus is overly specific and evidently inserted without regard to liberal, democratic, or general protection of other forms of communication or expression in the face of physical violence or danger. Because of this, I don’t disagree that this Compact is an underlined test to Vanderbilt’s Neutrality Principle which was one of the most direct features of the school I chose such for, and I do think signing this compact with priority to additional federal funding would diminish both the literal basis and the conversations, interactions, and literal existence of many organizations in Vanderbilt (Discussions Vanderbilt, ex.) that the school had stood upon for more than a century."
204,0,Vanderbilt should remain free from federal policing of higher education and protect itself and other institutions from future encroachment and interference.
205,0,"What makes Vanderbilt such a lovely place to be are the diverse voices that are present. By signing as is, I think a lot of us would question Vanderbilt’s integrity."
206,0,"I think that some of the ideas outlined in the document are in line with Vanderbilt's vision for higher education. However, I think it's still concerningly vague about what the consequences for how. Also think that there are some clauses that do not align with Vanderbilt's vision and or could potentially harm the university as an institution. I'm not completely against the signing of this document in the future, provided some of the clauses are reworked, however, I think it is important that the current version of the compact is not signed as is."
207,0,"This agreement only lasts five years and may bring some short-term benefits. As a university, we should take a longer-term view. Does signing it amount to taking a political side? And when a new administration comes in after those five years, how should Vanderbilt position itself?"
208,1,This will incentivise universities to become areas of free speech and provide greater human capital for the United States. This also provides for fairer admission standards
209,0,"As a transgender student, I would feel incredibly unsafe, betrayed, and disappointed if Vanderbilt were to sign this contract. This decision would impact my rights to life, liberty, and happiness and impact my housing, how I use the bathroom, and how I access healthcare on campus. I think signage of this contract would be a direct betrayal of Vanderbilt's integrity and their promise of institutional neutrality. I, and many of my fellow students, would see the decision to agree to this contract as a shameful one."
210,0,Education is separate from the federal government period
211,0,This compact is designed to infringe on institutional neutrality and is antithetical to everything Vanderbilt believes itself to be.
212,0,"I do not believe Vanderbilt should sign the Compact. Our university’s strength lies in its diversity of thought, background, and experience, values that have always pushed us to think critically and empathetically. The proposed restrictions, such as limits on international students and prohibitions on considering race or gender, would make our community less inclusive and less reflective of the world we hope to lead. I’m also concerned about the broader implications for academic freedom and open expression. Policies that tie funding to political definitions or restrict institutional speech risk creating an environment of self-censorship rather than open inquiry. Vanderbilt’s greatness comes from its ability to bring together people with different perspectives and allow honest, respectful debate. The Compact, as written, would threaten that core strength."
213,1,We would benefit As university to have smart students tuition payed for and benefit from domestic students helping the country in the future
214,0,Definitely not
215,0,The federal government should not limit expression of anti-conservative ideals on the campus of a private institution.
216,0,"It is foolish to base admission on most standard tests. Also, disruptions in class can be a form of free speech and any policy that goes against that should be very carefully worded. The conservative views part is entirely unnecessary and a severe overreach. The others are mostly acceptable."
217,0,"The contract opposes everything Vanderbilt stands for. A big draw to Vanderbilt is the diversity, which creates a thriving community of diverse opinions. We can learn so much from each other, and, as we have learned in Dialogue Vanderbilt, it is important to respect each other and learn. Signing the compact would take away a unique part of the Vanderbilt experience."
218,0,"violates institutional neutrality, which goes against Vanderbilt"
219,0,"As a female engineer, I think they should still strive to make engineering 50-50 women to men. I came to Vanderbilt because of their commitment to women in engineering."
220,0,"Despite my agreement with some of the rationale here, the terms are extremely vague and undefined which is very dangerous. I think it would be in Vanderbilts best interest to lock arms with the other universities to at the minimum clarify what’s being asked for. The danger here is retaliation against the whole group. If that risk is deemed to be too material, we are forced to sign."
221,0,"Regardless of whether or not I agree with the changes that the Trump administration is posing, there is no place in America for the White House to attach federal funding required for necessary, life-saving research to political ideology. Federal funds required for clinical trials and research should not be used as leverage in a battle of political ideologies."
222,0,It is way too vague and opens Vanderbilt up to political reprisal based on arbitrary determinations that may change at any given time.
223,1,"I think it will make admissions more fair! I am also very sick of professors being so biased talking badly about the conservative party even thought we are a neutral campus. I feel as thought a lot of neutrality is already similar to what the compact states so I think it will be more beneficial. In addition, many people are arguing that individuals who are transgender or in the process won't be allowed to use the bathroom. However, Vanderbilt has many gender neutral bathrooms for this reason so the compact would not change much. Lastly, a lot of people are shying away from majoring in political science because professors tend to be more biased so I hope that with this compact, more people will feel comfortable majoring in something they truly have a passion for. ."
224,0,The compact is entirely against all of Vanderbilt's values as an institution.
225,0,"worried about disability rights on campus and how vague the compact is (slippery slope). I think vanderbilt's supportive community makes it unique, and this would increase the feelings of hostility. I do like some parts of it (tuition for hard sciences, transparency in metrics, free speech - but I think Vandy already does this)"
226,0,Would be unfair to education majors and students studying liberal arts. Also allows government interference in private affairs and would lead to a loss of Vanderbilt as an institution instead of a tool of Trump’s regime. The tuition benefit is just to hook students it does not have the universities overall best interest in mind.
227,0,I don't like Trump or any of his policies. I have great pride in the school that I attend and to see its federal funding being controlled by someone who obviously does not value research or the furthering of educational knowledge.
228,0,It is terrible and disgusting.
229,0,Do not give into clearly partisan tactics. Retain our commitment to institutional neutrality.
230,0,"This is anti-constitutional and terrifying for our university, the values we are giving up would defeat our purpose of institutional neutrality."
231,0,"A university should not accept bribes in exchange for supporting a certain political agenda, especially as a research institution because it impacts the integrity of the scientific discoveries the university makes."
232,0,The government is currently radically right. To agree with them breaks the supposed neutrality held by Vanderbilt. Even inspite of the federal funding being held for coercion.
233,0,"If any of these things were true the day I applied to Vanderbilt, then I would not have gotten in. I'm very thankful to be a student at Vanderbilt University, and I think it's quite cretinous to apply such expectations to a private university."
234,0,I don’t think it allows us to continue a position of neutrality
235,0,A President should not have power over what universities teach. Universities should be the most powerful voices against a President who is overreaching his power.
236,0,"While I would love a tuition freeze, I feel as though many of the guidelines can be used to limit free speech. While the document claims personal free speech is aloud, so much of the student voice is supported through departments, the departmental limitations would effectively bar this form of free speech."
237,0,I think this is a disgusting manipulation of our higher education system to further us towards authoritarianism and I would hope that a leader in the higher ed world wouldn't succumb to this. Especially considering Vanderbilt already offers incredible financial aid packages and has one of the nations largest endowments. I would be ashamed as a student and alumni if Vandy signed the compact. How we as a community align ourselves will set a standard and sway our counterparts please make me a proud commodore.
